Unnamed: 0,Lacteos HBE,Precio Lacteos HBE,Lacteos Soriana,Precio Lacteos Soriana,Lacteos Chedraui,Precio Lacteos Chedraui,Lacteos LaComer,Precio Lacteos LaComer
,Yogurt Fresa 0% 150 Gr,31.9,Leche Lala Entera 1 L,22.9,Leche Alpura Clásica Pasteurizada 1L,20.4,Leche Uht Entera Proteina 0 Lactosa 100,25.65
,Yogurt Griego Natural 150 Gr,31.9,Leche Lala Deslactosada 1 L,23.0,Frutal Fresa Alpura 250ml,7.5,Leche Uht Semidescremada,24.0
,Yogurth Griego Chobani Core Cereza 150 Gr,31.9,Leche Lala Deslactosada Light 1 L,23.5,Frutal Durazno Alpura 250ml,7.5,Leche Uht Entera,20.65
,Yoghurt Griego Core Frambuesa 150 Gr,31.9,Leche Ultra Lala Light 1Lt,22.9,Frutal Piña-Coco Alpura 250ml,7.5,Leche Uht Semidescremada,9.0
,Yoghurt Griego Core Vainilla 150 Gr,31.9,Leche Alpura Clásica Entera 1 L,22.9,Yoghurt Alpura Batido Fresa 125g,5.1,Leche Uht Deslactosada Light,30.0
,Yogurt Griego Fresa Y Platano 150 Gr,31.9,Leche Alpura Light 1 L,22.9,Yoghurt Alpura Batido Durazno 125g,5.1,Leche Uht Entera,15.8
,Leche Condensada 387 Gr 397 Gr,24.0,Leche Alpura Semidescremada 1 L,22.9,Yoghurt Alpura Batido Mango 125g,5.1,Leche Uht Semidescremada,9.0
,Leche Evaporada Regular 360 Gr,17.0,Leche Deslactosada,19.9,Yoghurt Alpura Batido Manzana 125g,5.1,Leche Uht Deslactosada,21.5
,Leche Almendras Original 1.89 Lt,64.0,Leche Lala Semidescremada Reducida En Grasa 1 L,22.9,Yoghurt Alpura Batido Zarzamora 125g,5.1,Leche Fresca Entera,36.79
,Queso Panela 400 Gr,78.9,Leche Valley Foods Deslactosada Light 1 L,18.9,Yoghurt Alpura Batido Frutos del Bosque 125g,5.1,Producto Lacteo Uht Entero,15.55
,Fermentados Natural 400 Gr,32.0,Leche Valley Foods Light 1 L,17.9,Yoghurt Alpura Batido Piña-Coco 125g,5.1,Leche Uht Semidescremada,28.25
,Leche Uht Deslactosada Light 1 Lt,24.5,Lecha Entera Valley Foods 1 L,17.9,Yoghurt Alpura Batido Natural 125g,5.1,Leche Uht Entera,33.3
,Leche Uht Deslactosada Light 1 Lt,24.0,Leche Valley Foods Deslactosada 1 L,18.9,Yoghurt Alpura Batido Guayaba 125g,5.1,Leche Fresca Entera,32.65
,Huevo Blanco Mediano 30 Pz,56.0,Producto Lácteo Forti Plus Entera 1 L,16.1,Leche UHT Lala Yomi Fresa Slim 190 ml,5.5,Leche Uht Semidescremada,9.0
,Leche Uht 100 Proteina Reducida Grasa 1 Lt,28.0,Leche Baja En Grasa Uht,18.9,Leche UHT Lala Yomi Vainilla Slim 190 ml,5.5,Leche Uht Deslactosada Selecta,21.5
,Mantequilla Barra Con Sal 90 Gr,14.0,Leche Entera Uht,18.9,Leche UHT Lala Yomi Chocolate Slim 190 ml,5.5,Leche Uht Deslactosada,16.6
,Leche Uht Deslactosada 1 Lt,24.5,Leche Entera Uht San Marcos 1 Lt,21.5,Leche UHT Lala Yomi Chocolate 3 Pack Slim 190 ml,18.9,Leche Fresca Light 0 Lactosa 100,25.75
,Crema Liquida Regular 450 Ml,33.5,Leche Semidescremada Uht San Marcos 1 Lt,20.5,Alimento Líquido Lala Vita Amarant 960ml,36.3,Leche Uht Semidescremada,9.0
,Yogurt Griego Natural 150 Gr,19.5,Leche Valley Foods Semidescremada 1 L,17.9,Leche Lala Orgánica Deslactosada UHT 1L,30.0,Leche Uht Deslactosada,7.8
,Leche Uht Deslactosada Semidecremada 1Lt 1 Lt,24.0,Leche Alpura Deslactosada 1 L,22.5,Alimento Líquido Lala Vita Arroz 960ml,36.3,Leche Fresca Light,33.0
,Leche Uht Deslactosada 1.5Lt 1.5 Lt,35.0,Producto Lacteo Nutrileche 1Lt,15.75,Leche UHT Lala Yomi Vainilla 1L,23.5,Crema Acida,30.5
,Queso Chihuahua Menonita 550 Gr,97.0,Leche Fresca 100 Red Grasa Lala 1 Litro Bote,28.75,Leche UHT Lala Yomi Choco 1L,23.5,Crema Acida Deslactosada,31.9
,Fermentados Sin Azucar Pack 400 Gr,35.9,Leche Fresca 100 Semidesc Lala 1 Litro Bote,29.25,Leche UHT Lala Yomi Fresa 1L,23.5,Crema Acida Light,27.0
,Leche Uht Light 1 Lt,22.9,Leche Lala 100 Sin Lactosa Light+Proteína 1 L,27.5,Café con Lala UHT Deslactosado Slim 1L,27.0,Crema Acida Reducida En Grasa,26.85
,Leche Uht Entera 1Lt 1 Lt,23.0,Huevo Blanco Precissimo 30 Piezas,61.9,Café con Lala UHT Deslactosada 330g,15.5,Crema Acida,14.0
,Leche Uht Light 1Lt 1 Lt,23.0,Huevo Blanco Paq 30Pz San Juan,64.9,Leche UHT Lala Light 1 L,20.35,Crema Acida,26.45
,Leche Uht Deslactosada Entera 1 Lt,24.0,Huevo Blanco Paq 12Pz San Juan,31.9,Leche UHT Lala Deslactosada Semi 6 Pack de 1L,115.0,Crema Acida Premium,36.0
,Leche Entera 1 Six 6 Lt,128.0,Huevo Blanco Paq 18Pz San Juan,43.9,Leche UHT Lala Deslactosada Baja en Grasa 6 Pack de 1L,114.0,Crema Acida,59.0
,Queso Rallado Mezcla Mexicana 300 Gr,78.9,Huevo Blanco Soriana 12 Piezas,28.9,Leche UHT Lala Baja en Grasa 6 Pack de 1L,114.0,Crema Dulce,53.0
,Yogurt Griego Natural 145 Gr,8.0,Huevo Blanco Soriana 18 Piezas,40.9,Leche UHT Lala 100 Cacao Deslactosado 330ml,16.3,Crema Acida Deslactosada,14.3
,Formula Lactea Two Pack 2 Lt,34.0,Huevo Blanco Paq 30Pz Bachoco,64.9,Leche UHT Lala 100 sin lactosa Fresa 330ml,16.3,Crema Acida,49.65
,Mantequilla Sin Sal 90 Gr,18.0,Huevo Rojo Paq 18Pz Bachoco,41.0,Leche Lala 100 Semidescremada 1L,25.45,Crema Acida Reducida En Grasa,12.85
,Leche Uht Entera 1.5 Lt,32.5,Huevo Rojo Paq 12Pz Bachoco,28.5,Leche UHT Lala 100 sin lactosa Vainilla 330ml,16.3,Crema Acida Reducida En Grasa,54.0
,Huevo Blanco 18 Pz,55.0,Huevo Organico Paq 12 Pz E Él,66.9,Alimento Líquido Lala Vita 3Nueces 960ml,36.3,Crema Acida Deslactosada,62.3
,Yogurt Griego Natural 907 Gr,78.0,Huevo Blanco Orespi Jumbo 20 Piezas,57.9,Leche Lala 100 sin Lactosa 1L,25.0,Crema Acida Light,13.85
,Huevo Mediano Mt 30 Pz,56.0,Huevo Blanco Orespi Libre Pastoreo 12 Piezas,48.9,Leche UHT Lala Deslactosada Baja en Grasa 1.5L,30.3,Crema Dulce,95.0
,Huevo Blanco Jumbo Con Vitamina E 30 Pz,75.0,Orespi Huevo Blanco Neto 1080 Gr 18 Pz Paq,45.9,Alimento Líquido Lala Vita UHT Proteína 330ml,21.5,Crema Acida Light,51.0
,Yogurt Griego Batido Natural Sin Azucar 145 Gr,12.0,Orespi Huevo Blanco Neto 1650 Gr 30 Pz Paq,65.9,Leche UHT Lala Semi Deslactosada  1.5L,30.5,Crema Natural,31.5
,Media Crema 225 Gr,15.0,Orespi Huevo Blanco Neto 720 Gr 12 Pz Paq,29.9,Leche UHT Lala Orgánica Entera 1L,29.5,Crema Acida Premium Selecta,32.3
,Leche Uht Light 1 Lt,17.0,Claras De Huevo San Juan 1 Kg,44.6,Leche Lala 100 sin Lactosa 1L,24.9,Crema Acida Premium,60.5
,Margarina Untable Con Sal 425 Gr,24.0,Huevo Rojo Pack 18 Pz La Canasta,63.5,Alimento Líquido Lala Vita Almendra 960ml,36.3,Huevo Blanco,65.5
,Leche Uht Entera 1Lt 1 Lt,17.0,Orespi Huevo Rojo Neto 1650 Gr 30 Pz Paq,66.6,Alimento Líquido Lala Vita Coco 960 ml,36.3,Huevo Blanco,42.0
,Crema Liquida Regular 320 Gr,18.0,Huevo Codorniz Paq 24Pz San Andres,52.9,Alimento Liquido Lala Vita UHT Chocolate 330ml,16.0,Huevo Blanco,27.5
,Huevo Blanco Mediano 12 Pz,35.9,Claras De Huevo San Juan 500 G,26.2,Leche Lala 100 Reducida en Grasa 1L,26.25,Huevo Blanco,39.5
,Huevo Blanco 30 Pz,82.0,Huevo Blanco Paq 12Pz Bachoco,29.9,Leche UHT Siluette Plus Deslactosada 960 ml,24.0,Huevo Blanco,27.3
,Leche Light 1 Six 6 Lt,125.9,Huevo Blanco Paq 18Pz Bachoco,42.9,Leche UHT Lala Entera 1.5 L,28.7,Huevo Blanco,59.0
,Queso Panela Light 400Gr 400 Gr,81.0,Crema Líquida Norteñita 450 Ml,33.5,Leche UHT Lala 100 Deslactosada 1L,26.5,Huevo Blanco,77.07
,Queso Chihuahua Menonita Rallado 1 Kg,179.0,Crema Fresca Lala 431 Ml,25.5,Leche UHT Lala Entera 1L,19.65,Huevo Blanco,49.1
,Leche Evaporada 720 Gr,31.0,Crema Ácida Lala Entera 426 Ml,31.6,Leche UHT Lala Semidescremada 1L,20.3,Huevo Blanco,69.0
,Leche Almendras Vainilla 1.89 Lt,64.0,Crema Ácida Lala Reducida En Grasa 200 Ml,16.6,Leche Fresca Lala Entera 1L,20.5,Huevo Blanco,43.6
,Leche Uht 100 Proteina Semidesc 1 Lt,28.0,Crema Ácida Lala 900 Ml,65.0,Leche Fresca Lala Entera 1.80L,33.5,Huevo Blanco,75.23
,Leche Uht Sabor Vainilla 200 Ml,9.0,Crema Líquida Norteñita Sirve Fácil 320 Ml,21.25,Leche Lala 100 Deslactosada 1L,25.6,Huevo Blanco,69.0
,Queso Panela Light 400Grs 400 Gr,75.0,Crema Ácida Lala 200 Ml,16.6,Leche Fresca Lala Entera 1L,20.5,Huevo Blanco,34.7
,Huevo Blanco Mediano 18 Pz,36.9,Crema Fresca Lala 233 Ml,15.25,Leche Fresca Lala Entera 1 Galón,67.0,Huevo Blanco,29.0
,Queso Amarillo Reb Chen 180 Gr,50.0,Crema Ácida Lala Reducida En Grasa 426 Ml,31.6,Leche Lala Orgánica Pasteurizada 1L,27.0,Alimento Liquido Uht Almendra 0 Azucar,41.0
,Uht Deslactosada 6 Pack 6 Lt,133.0,Crema Ácida Lala Deslactosada 426 Ml,33.4,Leche Lala 100 Fresca sin Lactosa Light 1L,26.2,Alimento Liquido Uht Almendra,41.0
,Leche Uht Light 1 Lt,22.0,Crema Norteñita 430 Gramo Pieza,30.4,Leche Lala 100 Semidescremada 330ml,12.2,Alimento Liquido Uht Almendra 0 Azucar,41.0
,Heb Queso Mozarella Rallado 454 Gr,125.0,Crema Norteña Florentina 250 Ml,16.0,Leche Lala 100 Fresca Semidescremada 1L,27.5,Alimento Liquido Uht Almendra,41.0
,Leche Organica Entera 1L 1 Lt,31.0,Crema Norteñita 250 Gramo Pieza,19.0,Leche Fresca Lala Deslactosada 2% 1.80L,33.5,Alimento Liquido Uht Coco,35.5
,Queso Oaxaca 400 Gr,96.0,Crema Ácida Alpura 200 Gr,14.65,Leche Fresca Lala Deslactosada Semi 1.80 L,36.9,Alimento Liquido Uht Soya Light,30.0
